{
  "dlq_id": "dlq_8e70e1aaeab57ed0c31d0551e2466c1e",
  "replay_key": "n8n-58124|baserow_checkins_write",
  "source_workflow": "checkin_submit_v1",
  "source_execution_id": "n8n-58124",
  "correlation_id": "ci-20260904-01HV7DR4",
  "user_id": "mm-user-1004",
  "pod_id": "pod-nails-squad",
  "cycle_date": "2026-09-04",
  "checkin_type": "EOD",
  "failure_stage": "baserow_checkins_write",
  "attempt_count": 3,
  "status": "pending",
  "last_error_code": "BASEROW_503",
  "last_error_summary": "Baserow remained unavailable after three attempts.",
  "raw_submission": "- publish release notes @status:done ~30m",
  "created_at": "2026-09-04T16:07:21Z",
  "next_retry_at": "2026-09-04T16:22:21Z",
  "dm_notified_at": "2026-09-04T16:07:24Z",
  "resolved_at": null,
  "resolved_checkin_id": null,
  "replay_started_at": null,
  "replay_owner": null,
  "replay_attempt_count": 0,
  "retention_delete_after": null
}
